,stimulus,trial_name,task_type,correct_answer,lang
2,"La patente de un vehículo es una placa de metal o plástico fijada al vehículo con el propósito de identificación oficial. Todos los países requieren patentes para vehículos como autos, camiones y motocicletas. Su requerimiento para otros vehículos como bicicletas, botes o tractores puede variar por jurisdicción. El identificador de registro es una serie de letras o números que identifican únicamente al dueño de un vehículo dentro de la región del registro del vehículo. En algunos países, el identificador es único en todo el país, mientras que, en otros, es único dentro de un estado o provincia. Francia fue el primer país en introducir la patente, a fines del siglo diecinueve. Las patentes de principios de siglo veinte variaban en tamaño y forma de una jurisdicción a otra, de manera que, si una persona se mudaba, se necesitaba hacer nuevos agujeros en el auto para sostener la nueva patente. La estandarización de patentes llegó a fines de los años cincuenta, cuando los fabricantes de automóviles llegaron a un acuerdo con los distintos gobiernos y organizaciones internacionales.",meco_para_12,NR,,ES
3,"El identificador de la matrícula del vehículo puede estar compuesto por letras, dígitos y símbolos.",meco_para_12_qa_3,NR,False,ES
4,"Con las fechas de juicio de la corte penal internacional en 2013 tanto para el presidente Kenyatta como para el vicepresidente William Ruto en relación con las secuelas de las elecciones de 2007, el presidente de EE. UU., Barack Obama eligió no visitar el país a mediados de 2013 durante su viaje africano. Más tarde en el verano, Kenyatta visitó China por invitación del presidente Xi Jinping después de una parada en Rusia y no haber visitado Estados Unidos como presidente. En julio de 2015 Obama visitó Kenia, como el primer presidente estadounidense en visitar el país mientras estaba en el cargo.",a_Kenya_2,NR,,ES
5,¿Cuándo visitó Obama a Kenia finalmente?,a_Kenya_2_qa_3,NR,julio de 2015,ES
6,"Donde es el área de la sección transversal relevante para el volumen para el que se calcula el tensor de esfuerzo. Este formalismo incluye términos de presión relacionados con fuerzas que actúan normalmente en el área de la sección transversal (las diagonales de la matriz del tensor), así como términos de cizallamiento relacionados con las fuerzas que actúan paralelamente al área de la sección transversal (los elementos fuera de la diagonal). El tensor de esfuerzo tiene en cuenta las fuerzas que causan todas las deformaciones, incluso las tensiones de tracción y las compresiones.:133–134:38-1–38-11",a_Force_4,NR,,ES
7,¿Qué se utiliza para calcular el área de sección transversal en el volumen de un objeto?,a_Force_4_qa_1,NR,términos de presión,ES
8,"Las Ergänzungsschulen son escuelas secundarias o postsecundarias (no terciarias), que administran personas privadas, organizaciones privadas o en raras ocasiones, grupos religiosos y ofrecen un tipo de educación que no está disponible en las escuelas públicas. La mayoría de estas escuelas son escuelas vocacionales. Sin embargo, estas escuelas de formación profesional no forman parte del sistema educativo dual alemán. Las Ergänzungsschulen tienen la libertad de funcionar fuera de las normas gubernamentales y se financian en su totalidad cobrando a sus estudiantes tasas de matrícula.",a_Privateschool_0,NR,,ES
9,¿Qué tipo de escuelas son las más ergänzungsschulen?,a_Privateschool_0_qa_1,NR,vocacionales,ES
10,"La construcción es el proceso de levantar un edificio o infraestructura. La construcción difiere de la fabricación en que la fabricación normalmente implica la producción en masa de artículos similares sin un comprador determinado, mientras que la construcción generalmente se lleva a cabo en un lugar determinado para un cliente conocido. La construcción como sector comprende del seis al nueve por ciento del producto interior bruto de los países desarrollados. La construcción comienza con la planificación, el diseño [cita necesaria] y la financiación y continúa hasta que el proyecto esté construido y listo para su uso.",a_Construction_0,NR,,ES
11,¿Qué porcentaje del producto interior bruto comprende la construcción?,a_Construction_0_qa_2,NR,seis al nueve por ciento,ES
12,"El calor necesario para hervir el agua y suministrar el vapor puede derivarse de varias fuentes, generalmente de la quema de materiales combustibles con un suministro adecuado de aire en un espacio cerrado (llamado de varias maneras: cámara de combustión, chimenea...). En algunos casos la fuente de calor es un reactor nuclear, energía geotérmica, energía solar o calor residual de un motor de combustión interna o proceso industrial. En el caso de modelos o motores de vapor de juguete, la fuente de calor puede ser un calentador eléctrico.",a_Steamengine_0,IS,,ES
13,¿Qué tipo de elemento calefactor se utiliza a menudo en las máquinas de vapor de juguete?,q_after_a_Steamengine_0_qa_3,IS,eléctrico,ES
14,"Determinados acontecimientos de la vida de Lutero y la Reforma que tuvo lugar evocaban con frecuencia los himnos de Lutero. Esta conducta comenzó cuando se enteró de la ejecución de Johann Esch y Heinrich Voes, las primeras personas martirizadas por la Iglesia Católica Romana por tener opiniones luteranas, lo cual motivó a Lutero a escribir el himno «Ein neues Lied wir heben an» («Una nueva canción que elevamos»), que generalmente se conoce en inglés por la traducción de John C. Messenger del título y el primer verso «Flung to the Heedless Winds», cantado por Maria C. Tiddeman con la música que compuso Ibstone en 1875.",a_MartinLuther_3,IS,,ES
15,¿Qué himno escribió Lutero después del martirio de Esch y Voes?,q_after_a_MartinLuther_3_qa_2,IS,Ein neues Lied wir heben an,ES
16,"En Europa, el escenario norteamericano de la Guerra de los Siete Años no suele recibir un nombre distinto. Todo el conflicto internacional se conoce como la Guerra de los Siete Años. ""Siete años"" se refiere a los acontecimientos en Europa, desde la declaración oficial de guerra en 1756 hasta la firma del tratado de paz en 1763. Estas fechas no se corresponden con las luchas en el continente norteamericano, donde la contienda entre las dos potencias coloniales concluyó en gran medida en seis años, desde la Batalla de Jumonville Glen en 1754 hasta la captura de Montreal en 1760.",a_FrenchandIndianWar_0,IS,,ES
17,¿Cuándo fue tomada Montreal?,q_after_a_FrenchandIndianWar_0_qa_2,IS,1760,ES
18,"Sin embargo, debido a las diferentes declaraciones que realizaba, sus opiniones religiosas siguen siendo confusas. Por ejemplo, en su artículo "" Una máquina para acabar con la guerra"", publicado en 1937, Tesla declaraba lo siguiente:",a_NikolaTesla_4,IS,,ES
19,"Debido a ciertas declaraciones, ¿qué se creía sobre las opiniones religiosas de Tesla?",q_after_a_NikolaTesla_4_qa_1,IS,confusas,ES
20,"En 2010, la selva amazónica sufrió otra severa sequía, en algunos aspectos más extrema que la sequía de 2005. La región afectada era de aproximadamente 1 160 000 000 millas cuadradas (3 000 000 km2) de selva tropical, en comparación con 734 000 000 millas cuadradas (1 900 000 km2) en 2005. La sequía de 2010 tuvo tres epicentros donde murió la vegetación, mientras que en 2005 la sequía se concentró en la parte suroeste. Los estudios se publicaron en la revista Science. En un año normal, el Amazonas absorbe 1,5 gigatoneladas de dióxido de carbono; en 2005 se liberaron 5 gigatoneladas y en 2010 se liberaron 8 gigatoneladas.",a_Amazonrainforest_4,IS,,ES
21,¿Cuántas millas cuadradas tuvo la región afectada por la sequía de 2010?,q_after_a_Amazonrainforest_4_qa_1,IS,1 160 000 000,ES
