,stimulus,trial_name,task_type,correct_answer,lang,set_name
200,"The International Union for Conservation of Nature is an international organization working in the field of nature conservation and the sustainable use of natural resources. It is involved in data gathering and analysis, research, field projects, advocacy, and education. Its mission is to 'influence, encourage and assist societies throughout the world to conserve nature and to ensure that any use of natural resources is equitable and ecologically sustainable'. Over the past decades, the organization has widened its focus beyond conservation ecology and now incorporates issues related to sustainable development in its projects. Unlike many other international environmental organizations, it does not aim to mobilize the public in support of nature conservation. Instead, the organization tries to influence the actions of governments, business and other stakeholders by providing information and advice, and through building partnerships. The organization is best known to the wider public for compiling and publishing the Red List of Threatened Species, which assesses the conservation status of species worldwide. Today, the organization employs approximately one thousand full-time staff in more than fifty countries.",meco_para_11,NR,,EN,mturk_EN_v06
201,This organization is mostly run by volunteers.,meco_para_11_qa_1,NR,False,EN,mturk_EN_v06
202,"In Hinduism the spiritual teacher is known as a guru, and, in many traditions of Hinduism - especially those common in the West - the emphasis on spiritual mentorship is extremely high, with gurus often exercising a great deal of control over the lives of their disciples.",a_Teacher_3,NR,,EN,mturk_EN_v06
203,In what area is it common for spiritual mentorship to be extremely high?,a_Teacher_3_qa_3,NR,the West,EN,mturk_EN_v06
204,"Some of the oldest schools in South Africa are private church schools that were established by missionaries in the early nineteenth century. The private sector has grown ever since. After the abolition of apartheid, the laws governing private education in South Africa changed significantly. The South African Schools Act of 1996 recognises two categories of schools: ""public"" (state-controlled) and ""independent"" (which includes traditional private schools and schools which are privately governed[clarification needed].)",a_Privateschool_2,NR,,EN,mturk_EN_v06
205,"Along with public schools, what type of school was recognized under the South African Schools Act?",a_Privateschool_2_qa_2,NR,independent,EN,mturk_EN_v06
206,"The Broncos defeated the Pittsburgh Steelers in the divisional round, 23–16, by scoring 11 points in the final three minutes of the game. They then beat the defending Super Bowl XLIX champion New England Patriots in the AFC Championship Game, 20–18, by intercepting a pass on New England's 2-point conversion attempt with 17 seconds left on the clock. Despite Manning's problems with interceptions during the season, he didn't throw any in their two playoff games.",a_SuperBowl50_1,NR,,EN,mturk_EN_v06
207,Who did the Broncos defeat in the AFC Championship game?,a_SuperBowl50_1_qa_12,NR,New England Patriots,EN,mturk_EN_v06
208,"Teachers in Wales can be registered members of trade unions such as ATL, NUT or NASUWT and reports in recent years suggest that the average age of teachers in Wales is falling with teachers being younger than in previous years. A growing cause of concern are that attacks on teachers in Welsh schools which reached an all-time high between 2005 and 2010.",a_Teacher_1,NR,,EN,mturk_EN_v06
209,What is the NASUWT?,a_Teacher_1_qa_3,NR,trade unions,EN,mturk_EN_v06
210,"The agreements include fixed annual carriage fees of £30m for the channels with both channel suppliers able to secure additional capped payments if their channels meet certain performance-related targets. Currently there is no indication as to whether the new deal includes the additional Video On Demand and High Definition content which had previously been offered by BSkyB. As part of the agreements, both BSkyB and Virgin Media agreed to terminate all High Court proceedings against each other relating to the carriage of their respective basic channels.",a_SkyUnitedKingdom_4,IS,,EN,mturk_EN_v06
211,What were high court proceedings being held about?,q_after_a_SkyUnitedKingdom_4_qa_4,IS,basic channels,EN,mturk_EN_v06
212,"After an unmanned LM test flight AS-206, a crew would fly the first Block II CSM and LM in a dual mission known as AS-207/208, or AS-278 (each spacecraft would be launched on a separate Saturn IB.) The Block II crew positions were titled Commander (CDR) Command Module Pilot (CMP) and Lunar Module Pilot (LMP). The astronauts would begin wearing a new Apollo spacesuit, designed to accommodate lunar extravehicular activity (EVA). The traditional visor helmet was replaced with a clear ""fishbowl"" type for greater visibility, and the lunar surface EVA suit would include a water-cooled undergarment.",a_Apolloprogram_1,IS,,EN,mturk_EN_v06
213,"What type of undergarment, if any, was included into the Apollo spacesuit?",q_after_a_Apolloprogram_1_qa_3,IS,water-cooled undergarment.,EN,mturk_EN_v06
214,"Ergänzungsschulen are secondary or post-secondary (non-tertiary) schools, which are run by private individuals, private organizations or rarely, religious groups and offer a type of education which is not available at public schools. Most of these schools are vocational schools. However, these vocational schools are not part of the German dual education system. Ergänzungsschulen have the freedom to operate outside of government regulation and are funded in whole by charging their students tuition fees.",a_Privateschool_0,IS,,EN,mturk_EN_v06
215,What types of schools are most ergänzungsschulen?,q_after_a_Privateschool_0_qa_1,IS,vocational,EN,mturk_EN_v06
216,"In most countries, the dispensary is subject to pharmacy legislation; with requirements for storage conditions, compulsory texts, equipment, etc., specified in legislation. Where it was once the case that pharmacists stayed within the dispensary compounding/dispensing medications, there has been an increasing trend towards the use of trained pharmacy technicians while the pharmacist spends more time communicating with patients. Pharmacy technicians are now more dependent upon automation to assist them in their new role dealing with patients' prescriptions and patient safety issues.",a_Pharmacy_2,IS,,EN,mturk_EN_v06
217,What responsibilities were pharmacy technicians formerly limited to?,q_after_a_Pharmacy_2_qa_1,IS,within the dispensary compounding/dispensing medications,EN,mturk_EN_v06
218,"In 1973, Nixon named William E. Simon as the first Administrator of the Federal Energy Office, a short-term organization created to coordinate the response to the embargo. Simon allocated states the same amount of domestic oil for 1974 that each had consumed in 1972, which worked for states whose populations were not increasing. In other states, lines at gasoline stations were common. The American Automobile Association reported that in the last week of February 1974, 20% of American gasoline stations had no fuel.",a_1973oilcrisis_2,IS,,EN,mturk_EN_v06
219,"According to the AAA, what is the percentage of the gas stations that ran out of gasoline?",q_after_a_1973oilcrisis_2_qa_3,IS,20%,EN,mturk_EN_v06
220,"A vehicle registration plate is a metal or plastic plate attached to a vehicle for officialidentification purposes. All countries require registration plates for road vehicles such as cars, trucks,and motorcycles. Whether they are required for other vehicles, such as bicycles, boats, or tractors, may vary by jurisdiction. The registration identifier is a series of letters and digits that uniquely identifies the vehicle owner within the issuing region's vehicle register. In some countries, the identifier is unique within the entire country, while in others it is unique within a state or province. France was the first country to introduce the registration plate, in the late nineteenth century. Early twentieth century plates varied in size and shape from one jurisdiction to the next, such that if a person moved, new holes would need to be drilled into the automobile to support the new plate. Standardization of plates came in the late fifties, when automobile manufacturers came to an agreement with governments and international organizations.",meco_para_12,NR,,EN,mturk_EN_v07
221,The size of plates was standardized before World War II.,meco_para_12_qa_1,NR,False,EN,mturk_EN_v07
222,"Jacksonville is the largest city by population in the U.S. state of Florida, and the largest city by area in the contiguous United States. It is the county seat of Duval County, with which the city government consolidated in 1968. Consolidation gave Jacksonville its great size and placed most of its metropolitan population within the city limits; with an estimated population of 853,382 in 2014, it is the most populous city proper in Florida and the Southeast, and the 12th most populous in the United States. Jacksonville is the principal city in the Jacksonville metropolitan area, with a population of 1,345,596 in 2010.",a_JacksonvilleFlorida_0,NR,,EN,mturk_EN_v07
223,What was the population Jacksonville city as of 2010?,a_JacksonvilleFlorida_0_qa_1,NR,"1,345,596",EN,mturk_EN_v07
224,"In the early 1970s, ABC completed its transition to color; the decade as a whole would mark a turning point for ABC, as it began to pass CBS and NBC in the ratings to become the first place network. It also began to use behavioral and demographic data to better determine what types of sponsors to sell advertising slots to and provide programming that would appeal towards certain audiences. ABC's gains in audience share were greatly helped by the fact that several smaller markets had grown large enough to allow full-time affiliations from all three networks.",a_AmericanBroadcastingCompany_3,NR,,EN,mturk_EN_v07
225,In what decade did ABC finish transitioning to color?,a_AmericanBroadcastingCompany_3_qa_0,NR,1970s,EN,mturk_EN_v07
226,"Child labour is common in Kenya. Most working children are active in agriculture. In 2006, UNICEF estimated that up to 30% of girls in the coastal areas of Malindi, Mombasa, Kilifi, and Diani were subject to prostitution. Most of the prostitutes in Kenya are aged 9–18. The Ministry of Gender and Child Affairs employed 400 child protection officers in 2009. The causes of child labour include poverty, the lack of access to education and weak government institutions. Kenya has ratified Convention No. 81 on labour inspection in industries and Convention No. 129 on labour inspection in agriculture.",a_Kenya_3,NR,,EN,mturk_EN_v07
227,What percent of girls are in prostution in Kenyas coastal areas?,a_Kenya_3_qa_1,NR,up to 30%,EN,mturk_EN_v07
228,"Southern California is home to Los Angeles International Airport, the second-busiest airport in the United States by passenger volume (see World's busiest airports by passenger traffic) and the third by international passenger volume (see Busiest airports in the United States by international passenger traffic); San Diego International Airport the busiest single runway airport in the world; Van Nuys Airport, the world's busiest general aviation airport; major commercial airports at Orange County, Bakersfield, Ontario, Burbank and Long Beach; and numerous smaller commercial and general aviation airports.",a_SouthernCalifornia_2,NR,,EN,mturk_EN_v07
229,What is the world's busiest general aviation airport?,a_SouthernCalifornia_2_qa_4,NR,Van Nuys Airport,EN,mturk_EN_v07
230,"Between 1402 and 1405, the expedition led by the Norman noble Jean de Bethencourt and the Poitevine Gadifer de la Salle conquered the Canarian islands of Lanzarote, Fuerteventura and El Hierro off the Atlantic coast of Africa. Their troops were gathered in Normandy, Gascony and were later reinforced by Castilian colonists.",a_Normans_4,IS,,EN,mturk_EN_v07
231,What continent are the Canarian Islands off the coast of?,q_after_a_Normans_4_qa_0,IS,Africa,EN,mturk_EN_v07
232,"For many years, Sudan had an Islamist regime under the leadership of Hassan al-Turabi. His National Islamic Front first gained influence when strongman General Gaafar al-Nimeiry invited members to serve in his government in 1979. Turabi built a powerful economic base with money from foreign Islamist banking systems, especially those linked with Saudi Arabia. He also recruited and built a cadre of influential loyalists by placing sympathetic students in the university and military academy while serving as minister of education.",a_Islamism_3,IS,,EN,mturk_EN_v07
233,Who was the leader of the Islamist regime in Sudan?,q_after_a_Islamism_3_qa_1,IS,Hassan al-Turabi,EN,mturk_EN_v07
234,"The plugs-out test began on the morning of January 27, 1967, and immediately was plagued with problems. First the crew noticed a strange odor in their spacesuits, which delayed the sealing of the hatch. Then, communications problems frustrated the astronauts and forced a hold in the simulated countdown. During this hold, an electrical fire began in the cabin, and spread quickly in the high pressure, 100% oxygen atmosphere. Pressure rose high enough from the fire that the cabin burst and the fire erupted onto the pad area, frustrating attempts to rescue the crew. The astronauts were asphyxiated before the hatch could be opened.",a_Apolloprogram_3,IS,,EN,mturk_EN_v07
235,What type of atmosphere helped fuel the fire throughout the cabin?,q_after_a_Apolloprogram_3_qa_4,IS,100% oxygen,EN,mturk_EN_v07
236,"In the years after these rumors, neither Tesla nor Edison won the prize (although Edison did receive one of 38 possible bids in 1915 and Tesla did receive one of 38 possible bids in 1937).",a_NikolaTesla_3,IS,,EN,mturk_EN_v07
237,How many possible bids for the prize were there in 1915?,q_after_a_NikolaTesla_3_qa_0,IS,38,EN,mturk_EN_v07
238,There are some common misconceptions about the outer and inner chloroplast membranes. The fact that chloroplasts are surrounded by a double membrane is often cited as evidence that they are the descendants of endosymbiotic cyanobacteria. This is often interpreted as meaning the outer chloroplast membrane is the product of the host's cell membrane infolding to form a vesicle to surround the ancestral cyanobacterium—which is not true—both chloroplast membranes are homologous to the cyanobacterium's original double membranes.,a_Chloroplast_4,IS,,EN,mturk_EN_v07
239,What is evidence chloroplasts descended from endosymbiotic cyanobacteria?,q_after_a_Chloroplast_4_qa_0,IS,surrounded by a double membrane,EN,mturk_EN_v07
240,"In competitive sports, doping is the use of banned performance-enhancing drugs by athletic competitors. The term doping is widely used by organizations which regulate sporting competitions. The use of drugs to enhance performance is largely considered unethical, and is therefore prohibited by most international sports organizations, including the International Olympic Committee. Furthermore, athletes who take explicit measures to evade detection exacerbate the ethical violation with overt deception and cheating. Despite its prevalence in the headlines recently, doping is not a new phenomenon; in fact, it is as old as sport itself. From the use of substances in ancient chariot races to more recent controversies in baseball and cycling, popular views among athletes have varied widely over the years. In recent decades, authorities and sporting organizations have tried to strictly regulate the use of drugs in sport. The primary reasons for this ban are the health risks of performance-enhancing drugs, the equality of opportunity for athletes, and the positive example to the public set by drug-free sport. Anti-doping authorities have repeatedly emphasized that using performance-enhancing drugs goes against the 'spirit of sport'.",meco_para_3,NR,,EN,mturk_EN_v08
241,Was the use of doping first observed in ancient wrestling competitions?,meco_para_3_qa_3,NR,False,EN,mturk_EN_v08
242,"Throughout its existence, Warsaw has been a multi-cultural city. According to the 1901 census, out of 711,988 inhabitants 56.2% were Catholics, 35.7% Jews, 5% Greek orthodox Christians and 2.8% Protestants. Eight years later, in 1909, there were 281,754 Jews (36.9%), 18,189 Protestants (2.4%) and 2,818 Mariavites (0.4%). This led to construction of hundreds of places of religious worship in all parts of the town. Most of them were destroyed in the aftermath of the Warsaw Uprising of 1944. After the war, the new communist authorities of Poland discouraged church construction and only a small number were rebuilt.",a_Warsaw_2,NR,,EN,mturk_EN_v08
243,"Of Warsaw's inhabitants in 1901, what percentage was Catholic?",a_Warsaw_2_qa_2,NR,56.2%,EN,mturk_EN_v08
244,"When Sky Digital was launched in 1998 the new service used the Astra 2A satellite which was located at the 28.5°E orbital position, unlike the analogue service which was broadcast from 19.2°E. This was subsequently followed by more Astra satellites as well as Eutelsat's Eurobird 1 (now Eutelsat 33C) at 28.5°E), enabled the company to launch a new all-digital service, Sky, with the potential to carry hundreds of television and radio channels. The old position was shared with broadcasters from several European countries, while the new position at 28.5°E came to be used almost exclusively for channels that broadcast to the United Kingdom.",a_SkyUnitedKingdom_1,NR,,EN,mturk_EN_v08
245,When was Sky Digital launched?,a_SkyUnitedKingdom_1_qa_0,NR,1998,EN,mturk_EN_v08
246,"Their local rivals, Polonia Warsaw, have significantly fewer supporters, yet they managed to win Ekstraklasa Championship in 2000. They also won the country’s championship in 1946, and won the cup twice as well. Polonia's home venue is located at Konwiktorska Street, a ten-minute walk north from the Old Town. Polonia was relegated from the country's top flight in 2013 because of their disastrous financial situation. They are now playing in the 4th league (5th tier in Poland) -the bottom professional league in the National – Polish Football Association (PZPN) structure.",a_Warsaw_1,NR,,EN,mturk_EN_v08
247,Where is Polonia's home venue located?,a_Warsaw_1_qa_3,NR,Konwiktorska Street,EN,mturk_EN_v08
248,"Ranging from about 1 millimeter (0.039 in) to 1.5 meters (4.9 ft) in size, ctenophores are the largest non-colonial animals that use cilia (""hairs"") as their main method of locomotion. Most species have eight strips, called comb rows, that run the length of their bodies and bear comb-like bands of cilia, called ""ctenes,"" stacked along the comb rows so that when the cilia beat, those of each comb touch the comb below. The name ""ctenophora"" means ""comb-bearing"", from the Greek κτείς (stem-form κτεν-) meaning ""comb"" and the Greek suffix -φορος meaning ""carrying"".",a_Ctenophora_2,NR,,EN,mturk_EN_v08
249,Comb like bands of cilia are called what?,a_Ctenophora_2_qa_2,NR,ctenes,EN,mturk_EN_v08
250,"Endosymbiotic gene transfer is how we know about the lost chloroplasts in many chromalveolate lineages. Even if a chloroplast is eventually lost, the genes it donated to the former host's nucleus persist, providing evidence for the lost chloroplast's existence. For example, while diatoms (a heterokontophyte) now have a red algal derived chloroplast, the presence of many green algal genes in the diatom nucleus provide evidence that the diatom ancestor (probably the ancestor of all chromalveolates too) had a green algal derived chloroplast at some point, which was subsequently replaced by the red chloroplast.",a_Chloroplast_3,IS,,EN,mturk_EN_v08
251,What kind of chloroplasts did diatoms have but lost?,q_after_a_Chloroplast_3_qa_3,IS,green algal derived chloroplast,EN,mturk_EN_v08
252,"Computational complexity theory is a branch of the theory of computation in theoretical computer science that focuses on classifying computational problems according to their inherent difficulty, and relating those classes to each other. A computational problem is understood to be a task that is in principle amenable to being solved by a computer, which is equivalent to stating that the problem may be solved by mechanical application of mathematical steps, such as an algorithm.",a_Computationalcomplexitytheory_0,IS,,EN,mturk_EN_v08
253,What branch of theoretical computer science deals with broadly classifying computational problems by difficulty and class of relationship?,q_after_a_Computationalcomplexitytheory_0_qa_0,IS,Computational complexity theory,EN,mturk_EN_v08
254,"The Standard Industrial Classification and the newer North American Industry Classification System have a classification system for companies that perform or otherwise engage in construction. To recognize the differences of companies in this sector, it is divided into three subsectors: building construction, heavy and civil engineering construction, and specialty trade contractors. There are also categories for construction service firms (e.g., engineering, architecture) and construction managers (firms engaged in managing construction projects without assuming direct financial responsibility for completion of the construction project).",a_Construction_2,IS,,EN,mturk_EN_v08
255,What are construction managers?,q_after_a_Construction_2_qa_3,IS,firms engaged in managing construction projects without assuming direct financial responsibility for completion of the construction project,EN,mturk_EN_v08
256,"The historian Frederick W. Mote wrote that the usage of the term ""social classes"" for this system was misleading and that the position of people within the four-class system was not an indication of their actual social power and wealth, but just entailed ""degrees of privilege"" to which they were entitled institutionally and legally, so a person's standing within the classes was not a guarantee of their standing, since there were rich and well socially standing Chinese while there were less rich Mongol and Semu than there were Mongol and Semu who lived in poverty and were ill treated.",a_Yuandynasty_4,IS,,EN,mturk_EN_v08
257,There were many Mongols with what unexpected status?,q_after_a_Yuandynasty_4_qa_3,IS,lived in poverty and were ill treated,EN,mturk_EN_v08
258,"DECnet is a suite of network protocols created by Digital Equipment Corporation, originally released in 1975 in order to connect two PDP-11 minicomputers. It evolved into one of the first peer-to-peer network architectures, thus transforming DEC into a networking powerhouse in the 1980s. Initially built with three layers, it later (1982) evolved into a seven-layer OSI-compliant networking protocol. The DECnet protocols were designed entirely by Digital Equipment Corporation. However, DECnet Phase II (and later) were open standards with published specifications, and several implementations were developed outside DEC, including one for Linux.",a_Packetswitching_2,IS,,EN,mturk_EN_v08
259,DEC originally had 3 layers but evolved into how many layers,q_after_a_Packetswitching_2_qa_2,IS,seven,EN,mturk_EN_v08
260,"The International Union for Conservation of Nature is an international organization working in the field of nature conservation and the sustainable use of natural resources. It is involved in data gathering and analysis, research, field projects, advocacy, and education. Its mission is to 'influence, encourage and assist societies throughout the world to conserve nature and to ensure that any use of natural resources is equitable and ecologically sustainable'. Over the past decades, the organization has widened its focus beyond conservation ecology and now incorporates issues related to sustainable development in its projects. Unlike many other international environmental organizations, it does not aim to mobilize the public in support of nature conservation. Instead, the organization tries to influence the actions of governments, business and other stakeholders by providing information and advice, and through building partnerships. The organization is best known to the wider public for compiling and publishing the Red List of Threatened Species, which assesses the conservation status of species worldwide. Today, the organization employs approximately one thousand full-time staff in more than fifty countries.",meco_para_11,NR,,EN,mturk_EN_v09
261,This organization publishes the Red List of Threatened Species.,meco_para_11_qa_3,NR,True,EN,mturk_EN_v09
262,"The last glacial ran from ~74,000 (BP = Before Present), until the end of the Pleistocene (~11,600 BP). In northwest Europe, it saw two very cold phases, peaking around 70,000 BP and around 29,000–24,000 BP. The last phase slightly predates the global last ice age maximum (Last Glacial Maximum). During this time, the lower Rhine flowed roughly west through the Netherlands and extended to the southwest, through the English Channel and finally, to the Atlantic Ocean. The English Channel, the Irish Channel and most of the North Sea were dry land, mainly because sea level was approximately 120 m (390 ft) lower than today.",a_Rhine_2,NR,,EN,mturk_EN_v09
263,"Besides the North Sea and the Irish Channel, what else was lowered in the last cold phase?",a_Rhine_2_qa_4,NR,English Channel,EN,mturk_EN_v09
