,stimulus,trial_name,task_type,correct_answer,lang,set_name
398,"The last glacial ran from ~74,000 (BP = Before Present), until the end of the Pleistocene (~11,600 BP). In northwest Europe, it saw two very cold phases, peaking around 70,000 BP and around 29,000–24,000 BP. The last phase slightly predates the global last ice age maximum (Last Glacial Maximum). During this time, the lower Rhine flowed roughly west through the Netherlands and extended to the southwest, through the English Channel and finally, to the Atlantic Ocean. The English Channel, the Irish Channel and most of the North Sea were dry land, mainly because sea level was approximately 120 m (390 ft) lower than today.",a_Rhine_2,IS,,EN,mturk_EN_v15
399,How much lower was the North Sea in the last cold phase than it is today?,q_after_a_Rhine_2_qa_3,IS,120 m,EN,mturk_EN_v15
400,"In competitive sports, doping is the use of banned performance-enhancing drugs by athletic competitors. The term doping is widely used by organizations which regulate sporting competitions. The use of drugs to enhance performance is largely considered unethical, and is therefore prohibited by most international sports organizations, including the International Olympic Committee. Furthermore, athletes who take explicit measures to evade detection exacerbate the ethical violation with overt deception and cheating. Despite its prevalence in the headlines recently, doping is not a new phenomenon; in fact, it is as old as sport itself. From the use of substances in ancient chariot races to more recent controversies in baseball and cycling, popular views among athletes have varied widely over the years. In recent decades, authorities and sporting organizations have tried to strictly regulate the use of drugs in sport. The primary reasons for this ban are the health risks of performance-enhancing drugs, the equality of opportunity for athletes, and the positive example to the public set by drug-free sport. Anti-doping authorities have repeatedly emphasized that using performance-enhancing drugs goes against the 'spirit of sport'.",meco_para_3,NR,,EN,mturk_EN_v16
401,Do athletes use doping to calm down before their competition?,meco_para_3_qa_1,NR,False,EN,mturk_EN_v16
402,"During the divestment from South Africa movement in the late 1980s, student activists erected a symbolic ""shantytown"" on Harvard Yard and blockaded a speech given by South African Vice Consul Duke Kent-Brown. The Harvard Management Company repeatedly refused to divest, stating that ""operating expenses must not be subject to financially unrealistic strictures or carping by the unsophisticated or by special interest groups."" However, the university did eventually reduce its South African holdings by $230 million (out of $400 million) in response to the pressure.",a_HarvardUniversity_2,NR,,EN,mturk_EN_v16
403,When was the divestment from South Africa movement?,a_HarvardUniversity_2_qa_0,NR,late 1980s,EN,mturk_EN_v16
404,"The Standard Industrial Classification and the newer North American Industry Classification System have a classification system for companies that perform or otherwise engage in construction. To recognize the differences of companies in this sector, it is divided into three subsectors: building construction, heavy and civil engineering construction, and specialty trade contractors. There are also categories for construction service firms (e.g., engineering, architecture) and construction managers (firms engaged in managing construction projects without assuming direct financial responsibility for completion of the construction project).",a_Construction_2,NR,,EN,mturk_EN_v16
405,What are the three construction subsectors?,a_Construction_2_qa_0,NR,"building construction, heavy and civil engineering construction, and specialty trade contractors",EN,mturk_EN_v16
406,"The most frequent musical contributor during the first 15 years was Dudley Simpson, who is also well known for his theme and incidental music for Blake's 7, and for his haunting theme music and score for the original 1970s version of The Tomorrow People. Simpson's first Doctor Who score was Planet of Giants (1964) and he went on to write music for many adventures of the 1960s and 1970s, including most of the stories of the Jon Pertwee/Tom Baker periods, ending with The Horns of Nimon (1979). He also made a cameo appearance in The Talons of Weng-Chiang (as a Music hall conductor).",a_DoctorWho_3,NR,,EN,mturk_EN_v16
407,What was the episode name of Simpson's first Doctor Who score?,a_DoctorWho_3_qa_1,NR,Planet of Giants,EN,mturk_EN_v16
408,"Peyton Manning became the first quarterback ever to lead two different teams to multiple Super Bowls. He is also the oldest quarterback ever to play in a Super Bowl at age 39. The past record was held by John Elway, who led the Broncos to victory in Super Bowl XXXIII at age 38 and is currently Denver's Executive Vice President of Football Operations and General Manager.",a_SuperBowl50_2,NR,,EN,mturk_EN_v16
409,How old was Elway during his Super Bowl XXXIII win?,a_SuperBowl50_2_qa_7,NR,38,EN,mturk_EN_v16
410,"The costume collection is the most comprehensive in Britain, containing over 14,000 outfits plus accessories, mainly dating from 1600 to the present. Costume sketches, design notebooks, and other works on paper are typically held by the Word and Image department. Because everyday clothing from previous eras has not generally survived, the collection is dominated by fashionable clothes made for special occasions. One of the first significant gifts of costume came in 1913 when the V&A received the Talbot Hughes collection containing 1,442 costumes and items as a gift from Harrods following its display at the nearby department store.",a_VictoriaandAlbertMuseum_2,IS,,EN,mturk_EN_v16
411,Which department houses the works on paper of the costume collection?,q_after_a_VictoriaandAlbertMuseum_2_qa_1,IS,Word and Image,EN,mturk_EN_v16
412,"In 2000, ABC launched a web-based promotional campaign focused around its circle logo, also called ""the dot"", in which comic book character Little Dot prompted visitors to ""download the dot"", a program which would cause the ABC logo to fly around the screen and settle in the bottom-right corner. The network hired the Troika Design Group to design and produce its 2001–02 identity, which continued using the black-and-yellow coloring of the logo and featured dots and stripes in various promotional and identification spots.",a_AmericanBroadcastingCompany_0,IS,,EN,mturk_EN_v16
413,"In 2000, ABC started an internet based campaign focused on what?",q_after_a_AmericanBroadcastingCompany_0_qa_0,IS,circle logo,EN,mturk_EN_v16
414,"Even before Washington returned, Dinwiddie had sent a company of 40 men under William Trent to that point, where in the early months of 1754 they began construction of a small stockaded fort. Governor Duquesne sent additional French forces under Claude-Pierre Pecaudy de Contrecœur to relieve Saint-Pierre during the same period, and Contrecœur led 500 men south from Fort Venango on April 5, 1754. When these forces arrived at the fort on April 16, Contrecœur generously allowed Trent's small company to withdraw. He purchased their construction tools to continue building what became Fort Duquesne.",a_FrenchandIndianWar_2,IS,,EN,mturk_EN_v16
415,When did British begin to build fort under William Trent?,q_after_a_FrenchandIndianWar_2_qa_1,IS,1754,EN,mturk_EN_v16
416,"Chloroplasts have their own DNA, often abbreviated as ctDNA, or cpDNA. It is also known as the plastome. Its existence was first proved in 1962, and first sequenced in 1986—when two Japanese research teams sequenced the chloroplast DNA of liverwort and tobacco. Since then, hundreds of chloroplast DNAs from various species have been sequenced, but they're mostly those of land plants and green algae—glaucophytes, red algae, and other algal groups are extremely underrepresented, potentially introducing some bias in views of ""typical"" chloroplast DNA structure and content.",a_Chloroplast_2,IS,,EN,mturk_EN_v16
417,When was the first plastome sequenced?,q_after_a_Chloroplast_2_qa_3,IS,1986,EN,mturk_EN_v16
418,"Ranging from about 1 millimeter (0.039 in) to 1.5 meters (4.9 ft) in size, ctenophores are the largest non-colonial animals that use cilia (""hairs"") as their main method of locomotion. Most species have eight strips, called comb rows, that run the length of their bodies and bear comb-like bands of cilia, called ""ctenes,"" stacked along the comb rows so that when the cilia beat, those of each comb touch the comb below. The name ""ctenophora"" means ""comb-bearing"", from the Greek κτείς (stem-form κτεν-) meaning ""comb"" and the Greek suffix -φορος meaning ""carrying"".",a_Ctenophora_2,IS,,EN,mturk_EN_v16
419,What are cilia used for?,q_after_a_Ctenophora_2_qa_1,IS,method of locomotion,EN,mturk_EN_v16
420,"The International Union for Conservation of Nature is an international organization working in the field of nature conservation and the sustainable use of natural resources. It is involved in data gathering and analysis, research, field projects, advocacy, and education. Its mission is to 'influence, encourage and assist societies throughout the world to conserve nature and to ensure that any use of natural resources is equitable and ecologically sustainable'. Over the past decades, the organization has widened its focus beyond conservation ecology and now incorporates issues related to sustainable development in its projects. Unlike many other international environmental organizations, it does not aim to mobilize the public in support of nature conservation. Instead, the organization tries to influence the actions of governments, business and other stakeholders by providing information and advice, and through building partnerships. The organization is best known to the wider public for compiling and publishing the Red List of Threatened Species, which assesses the conservation status of species worldwide. Today, the organization employs approximately one thousand full-time staff in more than fifty countries.",meco_para_11,NR,,EN,mturk_EN_v17
421,This organization is mostly run by volunteers.,meco_para_11_qa_1,NR,False,EN,mturk_EN_v17
422,"Southern California is home to Los Angeles International Airport, the second-busiest airport in the United States by passenger volume (see World's busiest airports by passenger traffic) and the third by international passenger volume (see Busiest airports in the United States by international passenger traffic); San Diego International Airport the busiest single runway airport in the world; Van Nuys Airport, the world's busiest general aviation airport; major commercial airports at Orange County, Bakersfield, Ontario, Burbank and Long Beach; and numerous smaller commercial and general aviation airports.",a_SouthernCalifornia_2,NR,,EN,mturk_EN_v17
423,What is the world's busiest general aviation airport?,a_SouthernCalifornia_2_qa_4,NR,Van Nuys Airport,EN,mturk_EN_v17
424,"Undergraduate admission to Harvard is characterized by the Carnegie Foundation as ""more selective, lower transfer-in"". Harvard College accepted 5.3% of applicants for the class of 2019, a record low and the second lowest acceptance rate among all national universities. Harvard College ended its early admissions program in 2007 as the program was believed to disadvantage low-income and under-represented minority applicants applying to selective universities, yet for the class of 2016 an Early Action program was reintroduced.",a_HarvardUniversity_3,NR,,EN,mturk_EN_v17
425,In what year did Harvard end its early admission program?,a_HarvardUniversity_3_qa_1,NR,2007,EN,mturk_EN_v17
426,"Endosymbiotic gene transfer is how we know about the lost chloroplasts in many chromalveolate lineages. Even if a chloroplast is eventually lost, the genes it donated to the former host's nucleus persist, providing evidence for the lost chloroplast's existence. For example, while diatoms (a heterokontophyte) now have a red algal derived chloroplast, the presence of many green algal genes in the diatom nucleus provide evidence that the diatom ancestor (probably the ancestor of all chromalveolates too) had a green algal derived chloroplast at some point, which was subsequently replaced by the red chloroplast.",a_Chloroplast_3,NR,,EN,mturk_EN_v17
427,What shows us lost chloroplasts?,a_Chloroplast_3_qa_0,NR,Endosymbiotic gene transfer,EN,mturk_EN_v17
428,"Islamist movements such as the Muslim Brotherhood, ""are well known for providing shelters, educational assistance, free or low cost medical clinics, housing assistance to students from out of town, student advisory groups, facilitation of inexpensive mass marriage ceremonies to avoid prohibitively costly dowry demands, legal assistance, sports facilities, and women's groups."" All this compares very favourably against incompetent, inefficient, or neglectful governments whose commitment to social justice is limited to rhetoric.",a_Islamism_1,NR,,EN,mturk_EN_v17
429,Why has the Muslim Brotherhood facilitated inexpensive mass marriage ceremonies?,a_Islamism_1_qa_4,NR,avoid prohibitively costly dowry demands,EN,mturk_EN_v17
430,"Peyton Manning became the first quarterback ever to lead two different teams to multiple Super Bowls. He is also the oldest quarterback ever to play in a Super Bowl at age 39. The past record was held by John Elway, who led the Broncos to victory in Super Bowl XXXIII at age 38 and is currently Denver's Executive Vice President of Football Operations and General Manager.",a_SuperBowl50_2,IS,,EN,mturk_EN_v17
431,Who has the record of being the oldest quarter back in any Super Bowl game?,q_after_a_SuperBowl50_2_qa_8,IS,Peyton Manning,EN,mturk_EN_v17
432,"Luther's writings circulated widely, reaching France, England, and Italy as early as 1519. Students thronged to Wittenberg to hear Luther speak. He published a short commentary on Galatians and his Work on the Psalms. This early part of Luther's career was one of his most creative and productive. Three of his best-known works were published in 1520: To the Christian Nobility of the German Nation, On the Babylonian Captivity of the Church, and On the Freedom of a Christian.",a_MartinLuther_0,IS,,EN,mturk_EN_v17
433,When were some of Luther's best-known works published?,q_after_a_MartinLuther_0_qa_3,IS,1520,EN,mturk_EN_v17
434,"Korean economist Hoesung Lee is the chair of the IPCC since October 8, 2015, following the election of the new IPCC Bureau. Before this election, the IPCC was led by his vice-Chair Ismail El Gizouli, who was designated acting Chair after the resignation of Rajendra K. Pachauri in February 2015. The previous chairs were Rajendra K. Pachauri, elected in May 2002; Robert Watson in 1997; and Bert Bolin in 1988. The chair is assisted by an elected bureau including vice-chairs, working group co-chairs, and a secretariat.",a_IntergovernmentalPanelonClimateChange_0,IS,,EN,mturk_EN_v17
435,When did Pachauri resign as chair of the IPCC?,q_after_a_IntergovernmentalPanelonClimateChange_0_qa_4,IS,February 2015,EN,mturk_EN_v17
436,"The agreements include fixed annual carriage fees of £30m for the channels with both channel suppliers able to secure additional capped payments if their channels meet certain performance-related targets. Currently there is no indication as to whether the new deal includes the additional Video On Demand and High Definition content which had previously been offered by BSkyB. As part of the agreements, both BSkyB and Virgin Media agreed to terminate all High Court proceedings against each other relating to the carriage of their respective basic channels.",a_SkyUnitedKingdom_4,IS,,EN,mturk_EN_v17
437,What company agreed to terminate high court proceedings with Virgin Media?,q_after_a_SkyUnitedKingdom_4_qa_3,IS,BSkyB,EN,mturk_EN_v17
438,"Grissom, White, and Chaffee decided to name their flight Apollo 1 as a motivational focus on the first manned flight. They trained and conducted tests of their spacecraft at North American, and in the altitude chamber at the Kennedy Space Center. A ""plugs-out"" test was planned for January, which would simulate a launch countdown on LC-34 with the spacecraft transferring from pad-supplied to internal power. If successful, this would be followed by a more rigorous countdown simulation test closer to the February 21 launch, with both spacecraft and launch vehicle fueled.",a_Apolloprogram_2,IS,,EN,mturk_EN_v17
439,What was a plugs-out test done to simulate on the LC-34?,q_after_a_Apolloprogram_2_qa_2,IS,launch countdown,EN,mturk_EN_v17
440,"The International Union for Conservation of Nature is an international organization working in the field of nature conservation and the sustainable use of natural resources. It is involved in data gathering and analysis, research, field projects, advocacy, and education. Its mission is to 'influence, encourage and assist societies throughout the world to conserve nature and to ensure that any use of natural resources is equitable and ecologically sustainable'. Over the past decades, the organization has widened its focus beyond conservation ecology and now incorporates issues related to sustainable development in its projects. Unlike many other international environmental organizations, it does not aim to mobilize the public in support of nature conservation. Instead, the organization tries to influence the actions of governments, business and other stakeholders by providing information and advice, and through building partnerships. The organization is best known to the wider public for compiling and publishing the Red List of Threatened Species, which assesses the conservation status of species worldwide. Today, the organization employs approximately one thousand full-time staff in more than fifty countries.",meco_para_11,NR,,EN,mturk_EN_v18
441,Its main goal is to raise public awareness on nature conservation.,meco_para_11_qa_2,NR,False,EN,mturk_EN_v18
442,"Six-time Grammy winner and Academy Award nominee Lady Gaga performed the national anthem, while Academy Award winner Marlee Matlin provided American Sign Language (ASL) translation.",a_SuperBowl50_3,NR,,EN,mturk_EN_v18
443,Who sang the national anthem?,a_SuperBowl50_3_qa_5,NR,Lady Gaga,EN,mturk_EN_v18
444,"In Europe, the North American theater of the Seven Years' War usually is not given a separate name. The entire international conflict is known as the Seven Years' War. ""Seven Years"" refers to events in Europe, from the official declaration of war in 1756 to the signing of the peace treaty in 1763. These dates do not correspond with the fighting on mainland North America, where the fighting between the two colonial powers was largely concluded in six years, from the Battle of Jumonville Glen in 1754 to the capture of Montreal in 1760.",a_FrenchandIndianWar_0,NR,,EN,mturk_EN_v18
445,What was first battle in 1754?,a_FrenchandIndianWar_0_qa_3,NR,Battle of Jumonville Glen,EN,mturk_EN_v18
446,"There are also several smaller freight operators and numerous tourist railways operating over lines which were once parts of a state-owned system. Victorian lines mainly use the 1,600 mm (5 ft 3 in) broad gauge. However, the interstate trunk routes, as well as a number of branch lines in the west of the state have been converted to 1,435 mm (4 ft 8 1⁄2 in) standard gauge. Two tourist railways operate over 760 mm (2 ft 6 in) narrow gauge lines, which are the remnants of five formerly government-owned lines which were built in mountainous areas.",a_VictoriaAustralia_3,NR,,EN,mturk_EN_v18
447,Where were the narrow gauge rail lines built in Victoria?,a_VictoriaAustralia_3_qa_3,NR,mountainous areas,EN,mturk_EN_v18
448,"The University is organized into eleven separate academic units—ten faculties and the Radcliffe Institute for Advanced Study—with campuses throughout the Boston metropolitan area: its 209-acre (85 ha) main campus is centered on Harvard Yard in Cambridge, approximately 3 miles (5 km) northwest of Boston; the business school and athletics facilities, including Harvard Stadium, are located across the Charles River in the Allston neighborhood of Boston and the medical, dental, and public health schools are in the Longwood Medical Area. Harvard's $37.6 billion financial endowment is the largest of any academic institution.",a_HarvardUniversity_0,NR,,EN,mturk_EN_v18
449,What is the size of the school's endowment?,a_HarvardUniversity_0_qa_1,NR,$37.6 billion,EN,mturk_EN_v18
450,"In 1891 Scottish chemist James Dewar was able to produce enough liquid oxygen to study. The first commercially viable process for producing liquid oxygen was independently developed in 1895 by German engineer Carl von Linde and British engineer William Hampson. Both men lowered the temperature of air until it liquefied and then distilled the component gases by boiling them off one at a time and capturing them. Later, in 1901, oxyacetylene welding was demonstrated for the first time by burning a mixture of acetylene and compressed O2. This method of welding and cutting metal later became common.",a_Oxygen_1,IS,,EN,mturk_EN_v18
451,What welding process was demonstrated in 1901?,q_after_a_Oxygen_1_qa_3,IS,oxyacetylene welding,EN,mturk_EN_v18
452,"Luther's hymns were frequently evoked by particular events in his life and the unfolding Reformation. This behavior started with his learning of the execution of Johann Esch and Heinrich Voes, the first individuals to be martyred by the Roman Catholic Church for Lutheran views, prompting Luther to write the hymn ""Ein neues Lied wir heben an"" (""A new song we raise""), which is generally known in English by John C. Messenger's translation by the title and first line ""Flung to the Heedless Winds"" and sung to the tune Ibstone composed in 1875 by Maria C. Tiddeman.",a_MartinLuther_3,IS,,EN,mturk_EN_v18
453,Who is the English translator of this hymn?,q_after_a_MartinLuther_3_qa_3,IS,John C. Messenger,EN,mturk_EN_v18
454,"The Harvard Business School and many of the university's athletics facilities, including Harvard Stadium, are located on a 358-acre (145 ha) campus opposite the Cambridge campus in Allston. The John W. Weeks Bridge is a pedestrian bridge over the Charles River connecting both campuses. The Harvard Medical School, Harvard School of Dental Medicine, and the Harvard School of Public Health are located on a 21-acre (8.5 ha) campus in the Longwood Medical and Academic Area approximately 3.3 miles (5.3 km) southwest of downtown Boston and 3.3 miles (5.3 km) south of the Cambridge campus.",a_HarvardUniversity_1,IS,,EN,mturk_EN_v18
455,What is the name of the bridge that joins parts of the campus of the Charles River?,q_after_a_HarvardUniversity_1_qa_1,IS,John W. Weeks Bridge,EN,mturk_EN_v18
456,"Chloroplasts have their own DNA, often abbreviated as ctDNA, or cpDNA. It is also known as the plastome. Its existence was first proved in 1962, and first sequenced in 1986—when two Japanese research teams sequenced the chloroplast DNA of liverwort and tobacco. Since then, hundreds of chloroplast DNAs from various species have been sequenced, but they're mostly those of land plants and green algae—glaucophytes, red algae, and other algal groups are extremely underrepresented, potentially introducing some bias in views of ""typical"" chloroplast DNA structure and content.",a_Chloroplast_2,IS,,EN,mturk_EN_v18
457,What is a synonym for chloroplast DNA?,q_after_a_Chloroplast_2_qa_1,IS,the plastome,EN,mturk_EN_v18
458,"When Sky Digital was launched in 1998 the new service used the Astra 2A satellite which was located at the 28.5°E orbital position, unlike the analogue service which was broadcast from 19.2°E. This was subsequently followed by more Astra satellites as well as Eutelsat's Eurobird 1 (now Eutelsat 33C) at 28.5°E), enabled the company to launch a new all-digital service, Sky, with the potential to carry hundreds of television and radio channels. The old position was shared with broadcasters from several European countries, while the new position at 28.5°E came to be used almost exclusively for channels that broadcast to the United Kingdom.",a_SkyUnitedKingdom_1,IS,,EN,mturk_EN_v18
459,When was Sky Digital launched?,q_after_a_SkyUnitedKingdom_1_qa_0,IS,1998,EN,mturk_EN_v18
460,"In competitive sports, doping is the use of banned performance-enhancing drugs by athletic competitors. The term doping is widely used by organizations which regulate sporting competitions. The use of drugs to enhance performance is largely considered unethical, and is therefore prohibited by most international sports organizations, including the International Olympic Committee. Furthermore, athletes who take explicit measures to evade detection exacerbate the ethical violation with overt deception and cheating. Despite its prevalence in the headlines recently, doping is not a new phenomenon; in fact, it is as old as sport itself. From the use of substances in ancient chariot races to more recent controversies in baseball and cycling, popular views among athletes have varied widely over the years. In recent decades, authorities and sporting organizations have tried to strictly regulate the use of drugs in sport. The primary reasons for this ban are the health risks of performance-enhancing drugs, the equality of opportunity for athletes, and the positive example to the public set by drug-free sport. Anti-doping authorities have repeatedly emphasized that using performance-enhancing drugs goes against the 'spirit of sport'.",meco_para_3,NR,,EN,mturk_EN_v19
461,Was the use of doping first observed in ancient wrestling competitions?,meco_para_3_qa_3,NR,False,EN,mturk_EN_v19
