,stimulus,trial_name,task_type,correct_answer,lang,set_name
656,"El historiador Frederick W. Mote escribió que el uso del término ""clases sociales"" para este sistema era engañoso, y que la posición de las personas dentro del sistema de cuatro clases no era una indicación de su poder social y riqueza, sino que solo implicaba ""grados de privilegio"" a los que tenían derecho institucional y legal, por lo que la posición de una persona dentro de las clases no era una garantía de su posición, ya que había chinos ricos y socialmente consolidados, mientras que había menos mongoles y semu ricos que mongoles y semu que vivieran en la pobreza y fueran maltratados.",a_Yuandynasty_4,IS,,ES,mturk_ES_v08
657,¿Con qué estado inesperado había muchos mongoles?,q_after_a_Yuandynasty_4_qa_3,IS,vivieran en la pobreza y fueran maltratados,ES,mturk_ES_v08
658,"En 1891, el químico escocés James Dewar fue capaz de producir suficiente oxígeno líquido para estudiar. El primer proceso comercialmente viable para producir oxígeno líquido fue desarrollado independientemente en 1895 por el ingeniero alemán Carl von Linde y el ingeniero británico William Hampson. Ambos bajaron la temperatura del aire hasta licuarse y luego destilaron los gases que lo componen, hirviéndolos uno por uno y recogiéndolos. Más tarde, en 1901, se demostró por primera vez la soldadura oxiacetilénica quemando una mezcla de acetileno y O2 comprimido. Este método de soldar y cortar el metal se volvió común más tarde.",a_Oxygen_1,IS,,ES,mturk_ES_v08
659,¿Qué proceso de soldadura se demostró en 1901?,q_after_a_Oxygen_1_qa_3,IS,soldadura oxiacetilénica,ES,mturk_ES_v08
660,"La patente de un vehículo es una placa de metal o plástico fijada al vehículo con el propósito de identificación oficial. Todos los países requieren patentes para vehículos como autos, camiones y motocicletas. Su requerimiento para otros vehículos como bicicletas, botes o tractores puede variar por jurisdicción. El identificador de registro es una serie de letras o números que identifican únicamente al dueño de un vehículo dentro de la región del registro del vehículo. En algunos países, el identificador es único en todo el país, mientras que, en otros, es único dentro de un estado o provincia. Francia fue el primer país en introducir la patente, a fines del siglo diecinueve. Las patentes de principios de siglo veinte variaban en tamaño y forma de una jurisdicción a otra, de manera que, si una persona se mudaba, se necesitaba hacer nuevos agujeros en el auto para sostener la nueva patente. La estandarización de patentes llegó a fines de los años cincuenta, cuando los fabricantes de automóviles llegaron a un acuerdo con los distintos gobiernos y organizaciones internacionales.",meco_para_12,NR,,ES,mturk_ES_v09
661,La primera patente fue introducida en Francia.,meco_para_12_qa_0,NR,True,ES,mturk_ES_v09
662,"Se sospecha, aunque no ha sido demostrado, que muchas clases de complejidad conocidas pueden ser desiguales. Por ejemplo: P ⊆ NP ⊆ PP ⊆ PSPACE, aunque es posible que P = PSPACE. En el caso de que P no sea igual a NP, entonces P tampoco será igual a PSPACE. Dada la existencia de tantas clases de complejidad conocidas entre P y PSPACE como RP, BPP, PP, BQP, MA, PH, etc. es posible que todas estas clases converjan en una sola. Conseguir probar que alguna de estas clases es desigual supondría un gran descubrimiento en la teoría de la complejidad.",a_Computationalcomplexitytheory_4,NR,,ES,mturk_ES_v09
663,"¿En dónde pueden ubicarse las clases de complejidad RP, BPP, PP, BQP, MA y PH?",a_Computationalcomplexitytheory_4_qa_2,NR,entre P y PSPACE,ES,mturk_ES_v09
664,"Aunque la máquina de vapor de pistón ya no es de uso comercial generalizado, varias empresas están explorando o explotando el potencial de la máquina como alternativa a las máquinas de combustión interna. La empresa Energiprojekt AB en Suecia ha progresado en el uso de materiales modernos para aprovechar la potencia del vapor. La eficiencia de la máquina de vapor de Energiprojekt alcanza un 27-30 % en motores de alta presión. Es un motor de un solo paso y 5 cilindros (sin compuesto) con vapor sobrecalentado y consume aproximadamente 4 kg (8,8 libras) de vapor por kWh.[no se proporciona cita]",a_Steamengine_3,NR,,ES,mturk_ES_v09
665,¿Cuántos cilindros tiene el motor Energiprojekt AB?,a_Steamengine_3_qa_2,NR,5,ES,mturk_ES_v09
666,"Los escritos de Lutero se difundieron ampliamente y llegaron a Francia, Inglaterra e Italia ya en 1519. Los estudiantes acudían en masa a Wittenberg para escuchar hablar a Lutero. Este publicó un breve comentario sobre los gálatas y su obra sobre los Salmos. Esta parte temprana de la carrera de Lutero fue una de las más creativas y productivas. Tres de sus obras más conocidas se publicaron en 1520: «A la nobleza cristiana de la nación alemana», «El cautiverio babilónico de la Iglesia» y «Sobre la libertad del cristiano».",a_MartinLuther_0,NR,,ES,mturk_ES_v09
667,¿Quién fue a Wittenberg para escuchar hablar a Lutero?,a_MartinLuther_0_qa_1,NR,Los estudiantes,ES,mturk_ES_v09
668,"Determinados acontecimientos de la vida de Lutero y la Reforma que tuvo lugar evocaban con frecuencia los himnos de Lutero. Esta conducta comenzó cuando se enteró de la ejecución de Johann Esch y Heinrich Voes, las primeras personas martirizadas por la Iglesia Católica Romana por tener opiniones luteranas, lo cual motivó a Lutero a escribir el himno «Ein neues Lied wir heben an» («Una nueva canción que elevamos»), que generalmente se conoce en inglés por la traducción de John C. Messenger del título y el primer verso «Flung to the Heedless Winds», cantado por Maria C. Tiddeman con la música que compuso Ibstone en 1875.",a_MartinLuther_3,NR,,ES,mturk_ES_v09
669,¿Quién es el traductor inglés de ese himno?,a_MartinLuther_3_qa_3,NR,John C. Messenger,ES,mturk_ES_v09
670,"Entre 1402 y 1405, el noble normando Jean de Bethencourt y el francés Gadifer de la Salle lideraron la expedición que conquistó las islas canarias de Lanzarote, Fuerteventura y El Hierro en la costa atlántica de África. Sus tropas se agruparon en Normandía, Gascuña y más tarde se vieron reforzadas por los colonos castellanos.",a_Normans_4,IS,,ES,mturk_ES_v09
671,¿Enfrente a las costas de qué continente se encuentran las islas Canarias?,q_after_a_Normans_4_qa_0,IS,África,ES,mturk_ES_v09
672,"Kenia ocupa un puesto bajo en el Índice de Percepción de la Corrupción (IPC) de Transparencia Internacional, una medida que intenta medir la prevalencia de corrupción del sector público en varios países. En 2012, la nación la colocó en el puesto número 139 de 176 países en total en el IPC, con una puntuación de 27/100. Sin embargo, hay varios desarrollos bastante significativos con respecto a frenar la corrupción del gobierno de Kenia, por ejemplo, el establecimiento de una nueva e independiente Comisión de Ética y Anticorrupción (EACC).",a_Kenya_0,IS,,ES,mturk_ES_v09
673,¿Qué mide la escala del IPC?,q_after_a_Kenya_0_qa_1,IS,corrupción del sector público,ES,mturk_ES_v09
674,"La Royal Geographical Society de Londres y otras sociedades geográficas de Europa tuvieron gran influencia y pudieron financiar a los viajeros que regresaban con historias de sus descubrimientos. Estas sociedades también sirvieron como un espacio para que los viajeros compartieran estas historias. Geógrafos políticos como Friedrich Ratzel de Alemania y Halford Mackinder de Gran Bretaña también apoyaron al imperialismo. Ratzel creía que la expansión era necesaria para la supervivencia de un estado, mientras que Mackinder apoyaba la expansión imperial de Gran Bretaña; estos dos argumentos dominaron la disciplina durante décadas.",a_Imperialism_0,IS,,ES,mturk_ES_v09
675,¿Dónde nació Halford Mackinder?,q_after_a_Imperialism_0_qa_1,IS,Gran Bretaña,ES,mturk_ES_v09
676,"Los ambientalistas están preocupados por la pérdida de biodiversidad que se producirá como resultado de la destrucción del bosque, y también por la liberación del carbono contenido en la vegetación, que podría acelerar el calentamiento global. Los bosques perennes amazónicos representan alrededor del 10 % de la productividad primaria terrestre mundial y el 10 % de los depósitos de carbono en los ecosistemas, del orden de 1,1 × 1011 toneladas métricas de carbono. Se estima que los bosques amazónicos han acumulado 0,62 ± 0,37 toneladas de carbono por hectárea y año entre 1975 y 1996.",a_Amazonrainforest_3,IS,,ES,mturk_ES_v09
677,"¿De qué se deriva la pérdida de biodiversidad, según los ambientalistas?",q_after_a_Amazonrainforest_3_qa_1,IS,destrucción del bosque,ES,mturk_ES_v09
678,"En virtud del Acta de Escocia de 1978, se crearía una asamblea electa en Edimburgo siempre que la mayoría del electorado escocés votara a favor en un referéndum que se celebraría el 1 de marzo de 1979 y que representara al menos al 40 % del electorado total. El referéndum escocés de 1979 para establecer una Asamblea escocesa descentralizada fracasó. Aunque el voto fue de un 51,6 % a favor de una Asamblea Escocesa, esta cifra no igualó el 40 % del umbral total del electorado que se consideró necesario para aprobar la medida, ya que el 32,9 % de la población con derecho a voto no votó o no pudo hacerlo.",a_ScottishParliament_0,IS,,ES,mturk_ES_v09
679,¿Cuántos de los electores escoceses tendrían que votar a favor en el referéndum?,q_after_a_ScottishParliament_0_qa_1,IS,mayoría,ES,mturk_ES_v09
680,"La patente de un vehículo es una placa de metal o plástico fijada al vehículo con el propósito de identificación oficial. Todos los países requieren patentes para vehículos como autos, camiones y motocicletas. Su requerimiento para otros vehículos como bicicletas, botes o tractores puede variar por jurisdicción. El identificador de registro es una serie de letras o números que identifican únicamente al dueño de un vehículo dentro de la región del registro del vehículo. En algunos países, el identificador es único en todo el país, mientras que, en otros, es único dentro de un estado o provincia. Francia fue el primer país en introducir la patente, a fines del siglo diecinueve. Las patentes de principios de siglo veinte variaban en tamaño y forma de una jurisdicción a otra, de manera que, si una persona se mudaba, se necesitaba hacer nuevos agujeros en el auto para sostener la nueva patente. La estandarización de patentes llegó a fines de los años cincuenta, cuando los fabricantes de automóviles llegaron a un acuerdo con los distintos gobiernos y organizaciones internacionales.",meco_para_12,NR,,ES,mturk_ES_v10
681,"El identificador de la matrícula del vehículo puede estar compuesto por letras, dígitos y símbolos.",meco_para_12_qa_3,NR,False,ES,mturk_ES_v10
682,"Con las fechas de juicio de la corte penal internacional en 2013 tanto para el presidente Kenyatta como para el vicepresidente William Ruto en relación con las secuelas de las elecciones de 2007, el presidente de EE. UU., Barack Obama eligió no visitar el país a mediados de 2013 durante su viaje africano. Más tarde en el verano, Kenyatta visitó China por invitación del presidente Xi Jinping después de una parada en Rusia y no haber visitado Estados Unidos como presidente. En julio de 2015 Obama visitó Kenia, como el primer presidente estadounidense en visitar el país mientras estaba en el cargo.",a_Kenya_2,NR,,ES,mturk_ES_v10
683,¿Cuándo visitó Obama a Kenia finalmente?,a_Kenya_2_qa_3,NR,julio de 2015,ES,mturk_ES_v10
684,"Donde es el área de la sección transversal relevante para el volumen para el que se calcula el tensor de esfuerzo. Este formalismo incluye términos de presión relacionados con fuerzas que actúan normalmente en el área de la sección transversal (las diagonales de la matriz del tensor), así como términos de cizallamiento relacionados con las fuerzas que actúan paralelamente al área de la sección transversal (los elementos fuera de la diagonal). El tensor de esfuerzo tiene en cuenta las fuerzas que causan todas las deformaciones, incluso las tensiones de tracción y las compresiones.:133–134:38-1–38-11",a_Force_4,NR,,ES,mturk_ES_v10
685,¿Qué se utiliza para calcular el área de sección transversal en el volumen de un objeto?,a_Force_4_qa_1,NR,términos de presión,ES,mturk_ES_v10
686,"Las Ergänzungsschulen son escuelas secundarias o postsecundarias (no terciarias), que administran personas privadas, organizaciones privadas o en raras ocasiones, grupos religiosos y ofrecen un tipo de educación que no está disponible en las escuelas públicas. La mayoría de estas escuelas son escuelas vocacionales. Sin embargo, estas escuelas de formación profesional no forman parte del sistema educativo dual alemán. Las Ergänzungsschulen tienen la libertad de funcionar fuera de las normas gubernamentales y se financian en su totalidad cobrando a sus estudiantes tasas de matrícula.",a_Privateschool_0,NR,,ES,mturk_ES_v10
687,¿Qué tipo de escuelas son las más ergänzungsschulen?,a_Privateschool_0_qa_1,NR,vocacionales,ES,mturk_ES_v10
688,"La construcción es el proceso de levantar un edificio o infraestructura. La construcción difiere de la fabricación en que la fabricación normalmente implica la producción en masa de artículos similares sin un comprador determinado, mientras que la construcción generalmente se lleva a cabo en un lugar determinado para un cliente conocido. La construcción como sector comprende del seis al nueve por ciento del producto interior bruto de los países desarrollados. La construcción comienza con la planificación, el diseño [cita necesaria] y la financiación y continúa hasta que el proyecto esté construido y listo para su uso.",a_Construction_0,NR,,ES,mturk_ES_v10
689,¿Qué porcentaje del producto interior bruto comprende la construcción?,a_Construction_0_qa_2,NR,seis al nueve por ciento,ES,mturk_ES_v10
690,"El calor necesario para hervir el agua y suministrar el vapor puede derivarse de varias fuentes, generalmente de la quema de materiales combustibles con un suministro adecuado de aire en un espacio cerrado (llamado de varias maneras: cámara de combustión, chimenea...). En algunos casos la fuente de calor es un reactor nuclear, energía geotérmica, energía solar o calor residual de un motor de combustión interna o proceso industrial. En el caso de modelos o motores de vapor de juguete, la fuente de calor puede ser un calentador eléctrico.",a_Steamengine_0,IS,,ES,mturk_ES_v10
691,¿Qué tipo de elemento calefactor se utiliza a menudo en las máquinas de vapor de juguete?,q_after_a_Steamengine_0_qa_3,IS,eléctrico,ES,mturk_ES_v10
692,"Determinados acontecimientos de la vida de Lutero y la Reforma que tuvo lugar evocaban con frecuencia los himnos de Lutero. Esta conducta comenzó cuando se enteró de la ejecución de Johann Esch y Heinrich Voes, las primeras personas martirizadas por la Iglesia Católica Romana por tener opiniones luteranas, lo cual motivó a Lutero a escribir el himno «Ein neues Lied wir heben an» («Una nueva canción que elevamos»), que generalmente se conoce en inglés por la traducción de John C. Messenger del título y el primer verso «Flung to the Heedless Winds», cantado por Maria C. Tiddeman con la música que compuso Ibstone en 1875.",a_MartinLuther_3,IS,,ES,mturk_ES_v10
693,¿Qué himno escribió Lutero después del martirio de Esch y Voes?,q_after_a_MartinLuther_3_qa_2,IS,Ein neues Lied wir heben an,ES,mturk_ES_v10
694,"En Europa, el escenario norteamericano de la Guerra de los Siete Años no suele recibir un nombre distinto. Todo el conflicto internacional se conoce como la Guerra de los Siete Años. ""Siete años"" se refiere a los acontecimientos en Europa, desde la declaración oficial de guerra en 1756 hasta la firma del tratado de paz en 1763. Estas fechas no se corresponden con las luchas en el continente norteamericano, donde la contienda entre las dos potencias coloniales concluyó en gran medida en seis años, desde la Batalla de Jumonville Glen en 1754 hasta la captura de Montreal en 1760.",a_FrenchandIndianWar_0,IS,,ES,mturk_ES_v10
695,¿Cuándo fue tomada Montreal?,q_after_a_FrenchandIndianWar_0_qa_2,IS,1760,ES,mturk_ES_v10
696,"Sin embargo, debido a las diferentes declaraciones que realizaba, sus opiniones religiosas siguen siendo confusas. Por ejemplo, en su artículo "" Una máquina para acabar con la guerra"", publicado en 1937, Tesla declaraba lo siguiente:",a_NikolaTesla_4,IS,,ES,mturk_ES_v10
697,"Debido a ciertas declaraciones, ¿qué se creía sobre las opiniones religiosas de Tesla?",q_after_a_NikolaTesla_4_qa_1,IS,confusas,ES,mturk_ES_v10
698,"En 2010, la selva amazónica sufrió otra severa sequía, en algunos aspectos más extrema que la sequía de 2005. La región afectada era de aproximadamente 1 160 000 000 millas cuadradas (3 000 000 km2) de selva tropical, en comparación con 734 000 000 millas cuadradas (1 900 000 km2) en 2005. La sequía de 2010 tuvo tres epicentros donde murió la vegetación, mientras que en 2005 la sequía se concentró en la parte suroeste. Los estudios se publicaron en la revista Science. En un año normal, el Amazonas absorbe 1,5 gigatoneladas de dióxido de carbono; en 2005 se liberaron 5 gigatoneladas y en 2010 se liberaron 8 gigatoneladas.",a_Amazonrainforest_4,IS,,ES,mturk_ES_v10
699,¿Cuántas millas cuadradas tuvo la región afectada por la sequía de 2010?,q_after_a_Amazonrainforest_4_qa_1,IS,1 160 000 000,ES,mturk_ES_v10
700,"Η Διεθνής Ένωση Προστασίας της Φύσης εργάζεται για την προστασία της φύσης και της ορθής χρήσης των φυσικών πόρων. Δραστηριοποιείται στους τομείς της συλλογής και ανάλυσης δεδομένων, της έρευνας, των κατά τόπους έργων, της νομικής προστασίας και της εκπαίδευσης. Αποστολή της είναι να «επηρεάσει, να ενθαρρύνει και να βοηθήσει τις κοινωνίες σε όλο τον κόσμο να προστατεύσουν τη φύση και να διασφαλίσουν ότι η χρήση των φυσικών πόρων είναι δίκαιη και οικολογικά βιώσιμη». Τις τελευταίες δεκαετίες, η οργάνωση έχει διευρύνει τους τομείς δράσης της ενσωματώνοντας στα προγράμματά της, πέρα από θέματα προστασίας της φύσης, θέματα αειφόρου ανάπτυξης. Σε αντίθεση με πολλές άλλες διεθνείς περιβαλλοντικές οργανώσεις, δεν αποσκοπεί στην κινητοποίηση του κοινού. Αντιθέτως, προσπαθεί να επηρεάσει τις δράσεις κυβερνήσεων, επιχειρήσεων και άλλων εμπλεκομένων με την παροχή πληροφοριών, συμβουλών και την ανάπτυξη συνεργασιών. Η οργάνωση  είναι γνωστή στο ευρύτερο κοινό για τη σύνταξη και δημοσίευση της «Κόκκινης Λίστας Απειλούμενων Ειδών», η οποία αποτελεί ευρετήριο για την κατάσταση απειλούμενων ειδών φυτών και ζώων σε όλο τον κόσμο. Σήμερα, στην οργάνωση απασχολούνται με καθεστώς πλήρους απασχόλησης περίπου χίλια άτομα σε περισσότερες από πενήντα χώρες.",meco_para_11,NR,,GR,mturk_GR_v01
701,Η οργάνωση δημοσιεύει την κόκκινη λίστα απειλούμενων ειδών,meco_para_11_qa_3,NR,True,GR,mturk_GR_v01
702,"﻿O νέος θρησκευτικός πόλεμος του 1620 προκάλεσε την κατάργηση των πολιτικών και στρατιωτικών προνομίων των Ουγενότων μετά την ήττα τους. Διατήρησαν τις θρησκευτικές διατάξεις του διατάγματος της Νάντης μέχρι την εξουσία του Λουδοβίκου ΙΔ΄, ο οποίος σταδιακά ενίσχυσε τη δίωξή τους μέχρι να εκδώσει το Διάταγμα του Φονταινεμπλώ (1685 ), που κατήργησε κάθε νόμιμη αναγνώριση του Προτεσταντισμού στη Γαλλία και ανάγκασε τους Ουγενότους να αλλαξοπιστήσουν. Ενώ σχεδόν τα τρία τέταρτα τελικά σκοτώθηκαν ή υποτάχθηκαν, περίπου 500.000 Ουγενότοι είχαν εγκαταλείψει τη Γαλλία από τις αρχές του 18ου αιώνα [απαιτείται παραπομπή].",a_Huguenot_0,NR,,GR,mturk_GR_v01
703,Ποιος Γάλλος ευγενής εξέδωσε αυτή τη δήλωση;,a_Huguenot_0_qa_2,NR,Λουδοβίκου ΙΔ΄,GR,mturk_GR_v01
704,"Το Fresno εξυπηρετείται από το State Route 99, τον κύριο αυτοκινητόδρομο Βορρά / Νότου που συνδέει τα μεγάλα κέντρα πληθυσμού της Κεντρικής Κοιλάδας της Καλιφόρνια. Το State Route 168, το Sierra Freeway, κατευθύνεται ανατολικά προς την πόλη Clovis και τη λίμνη Huntington. Το State Route 41 (Yosemite Freeway/Eisenhower Freeway) φτάνει στο Φρέσνο από το Atascadero στον νότο, και στη συνέχεια κατευθύνεται βόρεια προς Yosemite. Το State Route 180,(Kings Canyon Freeway) έρχεται προς τα δυτικά μέσω Mendota και από τα ανατολικά στο εθνικό πάρκο Kings Canyon και πηγαίνει προς την πόλη Reedley.",a_FresnoCalifornia_3,NR,,GR,mturk_GR_v01
705,Ποιος δρόμος συνδέει το Φρέσνο με την Κεντρική Κοιλάδα της Καλιφόρνια;,a_FresnoCalifornia_3_qa_0,NR,State Route 99,GR,mturk_GR_v01
706,"Τα γραπτά του Λούθερ κυκλοφόρησαν ευρέως, φθάνοντας στη Γαλλία, την Αγγλία και την Ιταλία ήδη από το 1519. Οι μαθητές μαζεύτηκαν στο Wittenberg για να ακούσουν τον Λούθερ να μιλάει. Δημοσίευσε έναν σύντομο σχολιασμό για τους Γαλάτες και το έργο του με θέμα τους Ψαλμούς. Αυτό το πρώιμο μέρος της καριέρας του Λούθερ ήταν ένα από τα πιο δημιουργικά και παραγωγικά του. Τρία από τα πιο γνωστά έργα του δημοσιεύθηκαν το 1520: Για τη χριστιανική αριστοκρατία του γερμανικού έθνους, για την αιχμαλωσία της εκκλησίας της Βαβυλώνας, και για την ελευθερία ενός χριστιανού.",a_MartinLuther_0,NR,,GR,mturk_GR_v01
707,Πότε δημοσιεύθηκαν κάποια από τα πιο γνωστά έργα του Λούθερ;,a_MartinLuther_0_qa_3,NR,1520,GR,mturk_GR_v01
708,"Οι περιβαλλοντολόγοι ανησυχούν για την απώλεια της βιοποικιλότητας που θα προκύψει ως αποτέλεσμα της καταστροφής του δάσους, καθώς και για την απελευθέρωση άνθρακα που εμπεριέχεται στη βλάστηση, η οποία θα μπορούσε να επιταχύνει την παγκόσμια υπερθέρμανση. Τα αειθαλή δάση του Αμαζονίου αντιπροσωπεύουν περίπου το 10% της παγκόσμιας πρωτογενούς παραγωγικότητας και 10% των αποθεμάτων άνθρακα σε οικοσυστήματα - της τάξης 1,1 × 1011 μετρικοί τόνοι άνθρακα. Στα δάση του Αμαζονίου εκτιμάται ότι συσσωρεύτηκαν 0,62 ± 0,37 τόνοι άνθρακα ανά εκτάριο κάθε χρόνο, μεταξύ του 1975 και του 1996.",a_Amazonrainforest_3,NR,,GR,mturk_GR_v01
709,Πόσοι μετρικοί τόνοι άνθρακα πιστεύεται ότι είναι αποθηκευμένοι στο δάσος του Αμαζονίου;,a_Amazonrainforest_3_qa_4,NR,"1,1 × 1011",GR,mturk_GR_v01
